Date;text;approval_date
2017-07-22;american steel american hands constructed ton message world american might second none ussgeraldrford usa ship good people serve american sailor best world usnavy ussgeraldrford join live commissioning ceremony uss gerald r ford usa obamacare dead democrats obstructionists ideas votes obstruction solely republican senators republican senators must step plate years vote repeal replace next tax reform infrastructure win fairness anthony scaramucci wanted endorse st republican primaries started think running son donald openly gave e mails media authorities whereas crooked hillary clinton deleted acid washed e mails clinton ties russia including podesta company uranium deal russian reset big dollar speeches etc many people asking g special council looking many hillary clinton comey crimes e mails deleted agree u president complete power pardon think crime far leaks us fake news morning going commissioning ceremony largest aircraft carrier world gerald r ford norfolk va failing new york times foiled u attempt kill single wanted terroristal baghdadi sick agenda national security new intelligence leak amazon washington postthis time g jeff sessions illegal leaks like comey must stop sean spicer wonderful person took tremendous abuse fake news media future bright;38.38955
2017-07-23;hard read failing new york times amazon washington post every story opinion even positive bad sad republicans even carried line back little protect president phony russian witch hunt continues two groups laughing excuse lost election taking hold democrats russians every patriot serve ussgeraldrford keep watch protect defend love good luck godspeed;38.54961
2017-07-24;senator votes starting debate telling america fine w ocarenightmare remarks arriving joint base andrews secretaryperry secretaryzinke secpricemd republicans last chance right thing repeal replace years talking campaigning sleazy adam schiff totally biased congressman looking russia spends time television pushing dem loss excuse committees investigators course beleaguered g looking crooked hillarys crimes russia relations year investigation zero evidence found chuck schumer stated democrats blame ourselvesnot russia drain swamp changed drain sewer actually much worse anyone ever thought begins fake news thank loudobbs giving first six months trump administration c reg cuttingstock jobsborder etc true republicans repeal replace disastrous obamacare repercussions far greater understand;38.54928
2017-07-25;arrived youngstown ohio flotus melania makeamericagreatagain senjohnmccain thank coming c vital vote congrats rep deliver grt healthcare americans joint press conference prime minister saad hariri lebanon beginning shortly join us live america labor market continues boom jobs jobs jobs american people waited long enough enough talk action seven years time action traveling great state ohio tonight big crowd expected see interesting day healthcare dems obstructionists republicans great victory people working major trade deal united kingdom could big exciting jobs e u protectionist u stop jared kushner well yesterday proving collude russians witch hunt next year old barron trump great john mccain coming back vote brave american hero thank john obamacare torturing american people democrats fooled people long enough repeal repeal replace pen hand big day healthcare years talking soon see whether republicans willing step plate problem acting head fbi person charge hillary investigation andrew mccabe got h wife attorney general jeff sessions taken weak position hillary clinton crimes e mails dnc server intel leakers ukrainian efforts sabotage trump campaign quietly working boost clinton investigation g seanhannity fake news washington post used lobbyist weapon congress keep politicians looking amazon tax monopoly many stories washingtonpost fake news bad ratings challenged cnn lobbyist amazon taxes amazon washington post fabricated facts ending massive dangerous wasteful payments syrian rebels fighting assad jambo remember duty honor history take care people god puts life love cherish country;38.35725
2017-07-26;congratulations boys girls nation great honor welcome wh today full remarks america worship government worship god big dollars wife political run hillary clinton representatives drain swamp g sessions replace acting fbi director andrew mccabe comey friend charge clinton investigation got victory cannot burdened tremendous medical costs disruption transgender military would entail thank transgender individuals serve capacity u military military must focused decisive overwhelming consultation generals military experts please advised united states government accept allow senator lisamurkowski great state alaska really let republicans country yesterday bad crowd ohio amazing last night broke records great time great state back soon people ohio fantastic thank much evening great honor join wonderful veterans amvets post youngstown ohio evening grateful nation salutes;38.38412
2017-07-27;great honor present nation highest award public safety officer medal valor five american heroes today gathered east room pay tribute heroes whose courageous actions fire saved many lives alexandria va join live recognize first responders june th shooting involving stevescalise teamscalise big progress made ridding country ms gang members gang members general make america safe candidate trump catherine herridge foxnews fake news report witch hunt purposely phony reporting one things lost politics situation russians collected spread negative information false twitter iphone rt townhallcom abc nbc cbs pretty much bury scandal engulfing debbie wasserman schultz office true twitter iphone come republican senators healthcare years chance shine let american people false twitter iphone wow failing nytimes said foxandfriends powerful v show america thank foxconn investing billion dollars potential k new jobs wisconsin madeintheusa;38.35231
2017-07-28;would like thank reince priebus service dedication country accomplished lot together proud great leader john also done spectacular job homeland security true star administration pleased inform named general secretary john f kelly white house chief staff great american departing long island area siege ms gang members rest ms eradicated lesm always enforce laws protect borders support police lesmharrisburg pennsylvania flashbackfriday ms even though parts healthcare could pass really good things need many great future bills budgets need votes republicans going pass great future legislation senate must immediately go vote majority senseless republicans democrats let american people said beginning let obamacare implode deal watch go republican senators go get waiting years give america great healthcare;38.20862
2017-07-29;nothing us north korea talk longer allow continue china could easily solve problem disappointed china foolish past leaders allowed make hundreds billions dollars year trade yet love reading geniuses instrumental election success problem exist fake news maga unless republican senators total quitters repeal replace dead demand another vote voting bill u stock market almost since election new healthcare bill approved quickly bailouts insurance companies bailouts members congress end soon seven years talking repeal replace people great country still forced live imploding obamacare senate democrats ever got chance would switch majority vote first minute laughing r make change dems totally control u senate many great republican bills never pass like kate law complete healthcare get smart republicans senate never win go vote majority look like fools wasting time outdated filibuster rule must go budget reconciliation killing r senate mitch go votes win time republican senate must get rid vote killing r party allows dems control country bills sit senate joke words russia trump election want strong military low oil prices witch hunt defend country protect communities put safety american people first replay;37.76429
2017-07-30;give republican senators world watching repeal replace go votes nuke option get cross state lines;37.04735
2017-07-31;great day white house highest stock market ever best economic numbers years unemployment lowest years wages raising border secure c wh chaos obamacare hurting people hurt insurance companies congress paying public pays;37.01992
2017-08-01;fake news media trump enemies want stop using social media million people way get truth corporations never made much money making thank stuart varney foxandfriends jobs starting roarwatch stock market could hit time high today months ago election day mainstream media seldom mentions;36.91279
2017-08-02;campaigned creating merit based immigration system protects u workers taxpayers watch raiseact rust belt gave donald trump hero welcome great honor pay tribute vet went beyond call duty protect comrades country freedom small business owners dreamers innovators powering us future read watch;36.95828
2017-08-03;arrived west virginia make america great rally huntington pme massive crowd expected tune maga great veterans connect w va healthcare team anywhere using vavideoconnect available today announced another historic breakthrough va working tirelessly keep promises great veterans usa see tonight huntington west virginia makeamericagreatagain tickets relationship russia time dangerous low thank congress people even give us hcare continuing get rid costly unnecessary regulations much work left effect great business jobs grow business looking better ever business enthusiasm record levels stock market time high happen love white house one beautiful buildings homes ever seen fake news said called dump totally untrue;36.98021
2017-08-04;great work done fema dhsgov w state local leaders prepare hurricane season preparedness investment future matter mission brave men women uscg proudly answer call serve thank happy birthday cg excellent jobs numbers released begun many job stifling regulations continue fall movement back usa west virginia incredible last night crowds enthusiasm beyond gdp wow dem governor became republican last night consumer confidence year high good reason much regulation busting come working hard tax cuts reform forget foxconn spending billion dollars top line plant plants wisconsin toyota mazda build new b plant u create k new american jobs great investment american manufacturing thank west virginia across country americans every kind coming together w one simple goal make america great;36.60229
2017-08-05;united nations resolution single largest economic sanctions package ever north korea one billion dollars cost n k thank nicole many years leaks going washington great see g taking action national security tougher better united nations security council voted sanction north korea china russia voted us big financial impact working bedminster n j long planned construction done white house vacation meetings calls trump gains isis dramatically accelerated prosperity coming back shores putting america workers families first americafirst;36.90808
2017-08-06;make america great;36.86343
2017-08-07;think senator blumenthal take nice long vacation vietnam lied service least say much longer failing nytimes big losses massive unfunded liability non existent sources remain business fake news media talk importance united nations security council vote favor sanctions n korea purpleheartday thank brave men women sacrificed battle great nation usa conquests brave lie cried like baby begged forgiveness like child judges collusion never u history anyone lied defrauded voters like senator richard blumenthal told stories vietnam battles interesting watch senator richard blumenthal connecticut talking hoax russian collusion phony vietnam con artist working hard new jersey white house goes long planned renovation going new york next week meetings hard believe fake news cnn abc nbc cbs nytimes wapo trump base getting stronger supreme court pick economic enthusiasm deregulation much driven trump base even closer together never change west virginia fact fake news russian collusion story record stock market border security military strength jobs trump base far bigger stronger ever despite phony fake news polling look rallies penn iowa ohio failing nytimes made every wrong prediction including big election win apologized totally inept completed call president moon south korea happy impressed united nations vote north korea sanctions fake news refuses report success first months c surging economy jobsborder military securityisis ms etc;36.93701
2017-08-08;days rarely administration achieved achieved even close believe fake news suppression polls e mails show amazonwashingtonpost failingnewyorktimes reluctant cover clinton lynch secret meeting plane many years failurecountries coming together finally address dangers posed north korea must tough decisive holding major briefing opioid crisis major problem country today p bedminster n j;37.56736
2017-08-09;godblesstheusa senator mitch mcconnell said excessive expectations think years hearing repeal replace done hopefully never use power never time powerful nation world first order president renovate modernize nuclear arsenal far stronger powerful ever senator luther strange done great job representing people great state alabama complete total endorsement;37.62228
2017-08-10;trump approval rebounds surges among hispanics union homes men ivankatrump lead u delegation india fall supporting women fs entrepreneurship globally ges narendramodi mitch get back work put repeal replace tax reform cuts great infrastructure bill desk signing believe mitch mcconnell screamed repeal replace years get done must repeal replace obamacare;37.57039
2017-08-11;promised campaign trail provide opportunity americans gain skills needed succeed thrive economy grows consumer comfort reaches year high u economic optimism via bloomberg want make sure workforce development programs need ensure jobs military solutions fully placelocked loadedshould north korea act unwisely hopefully kim jong un find another path;37.39813
2017-08-12;condolences family young woman killed today best regards injured charlottesville virginia sad deepest condolences families fellow officers va state police died today among best nation produces continue follow developments charlottesville provide whatever assistance needed ready willing able must remember truth matter color creed religion political party americans first vital swift restoration law order protection innocent lives charlottesville join live bedminster new jersey bedminster meetings press conference v done make better charlottesville sad must united condemn hate stands place kind violence america lets come together one press conference following national security briefing bedminster new jersey;37.63694
2017-08-14;made additional remarks charlottesville realize fake news media never satisfied truly bad people leaving new york city meetings military purchases trade big day washington c even though white house oval office renovated great trade deals coming american workers merck pharma leader higher higher drug prices time taking jobs u bring jobs back lower prices ken frazier merck pharma resigned president manufacturing councilhe time lower ripoff drug prices obstructionist democrats given us fixed worst trade deals world history changing fast luther strange great state alabama endorsement strong border wall military tax cuts law enforcement heading washington morning much work focus trade military maga;37.85554000000001
2017-08-15;every ceo drops manufacturing council many take place grandstanders gone jobs big day alabama vote luther strange great foxandfriends according report president obama knew russian interference years ago want anger russia senator luther strange great job people alabama foxandfriends tough crime borders etc feels good home seven months white house special place like u really home;37.79533
2017-08-16;today bedminster signed harry w colmery veterans educational assistance act joined deptvetaffairs secshulkin landed bedminster new jersey maga rather putting pressure businesspeople manufacturing council strategy policy forum ending thank memorial service today beautiful incredible heather heyer truly special young woman long remembered wow senator luther strange picked lot additional support since endorsement september runoff strong wall crime make america great kim jong un north korea made wise well reasoned decision alternative would catastrophic unacceptable congratulations john congratulation roy moore luther strange final two heading september runoff alabama exciting race amazon great damage tax paying retailers towns cities states throughout u hurt many jobs lost;37.79533
2017-08-17;study general pershing united states terrorists caught radical islamic terror years united states condemns terror attack barcelona spain whatever necessary help tough strong love beauty taken cities towns parks greatly missed never able comparably replaced change history learn robert e lee stonewall jackson next washington jefferson foolish also sad see history culture great country ripped apart removal beautiful statues monuments many meetings today bedminster including secretary linda small business job numbers looking great great see dr kelli ward running flake jeff flake weak borders crime non factor senate toxic public learning even dishonest fake news totally misrepresent say hate bigotry etc shame people like ms heyer disgusting lie forget election trouncing people south carolina remember publicity seeking lindsey graham falsely stated said moral equivalency kkk neo nazis white supremacists thank mayorgimenez following rule law sanctuary cities make country less safe full remarks join p tuesday august nd phoenix arizona phoenix convention center tickets;37.72692
2017-08-18;returned bedminster nj camp david great meeting national security border military maga directed u cyber command elevated status unified combatant command focused cont heading camp david major meeting national security border military rapidly building strongest ever radical islamic terrorism must stopped whatever means necessary courts must give us back protective rights tough obstructionist democrats make security country difficult use courts associated delay times must stop homeland security law enforcement alert closely watching sign trouble borders far tougher ever;37.05765
2017-08-19;want applaud many protestors boston speaking bigotry hate country soon come together one great country divided decades sometimes need protest order heal heal stronger ever great country divided decades sometimes need protest order heel heel stronger ever great job law enforcement officers boston mayor marty walsh looks like many anti police agitators boston police looking tough smart thank steve bannon tough smart new voice breitbartnews maybe even better ever fake news needs competition important day spent camp david talented generals military leaders many decisions made including afghanistan want thank steve bannon service came campaign run crooked hillary clinton great thanks thoughts prayers kissimmeepolice loved ones lesm today signed global war terrorism war memorial act hr bill authorizes cont;36.81282
2017-08-20;heading back washington working hard watching worst dishonest fake news reporting ever seen;36.92514
2017-08-21;thank dishonest fake news media control jerry falwell liberty university fantastic foxandfriends fake news listen say thanks jerry thoughts prayers w usnavy sailors aboard ussjohnsmccain search rescue efforts underway;37.01527
2017-08-22;push onward victory w hope hearts courage souls everlasting pride every one god bless america see p tonight phoenix arizona maga tickets pray fallen heroes died serving country usnavy aboard ussjohnsmccain families great people last night fort myer virginia future country strong address nationfull video transcript thank men women fort myer every member u military home abroad usa join live fort myer arlington virginia;36.91675
2017-08-23;great honor sign veterans appeals improvement modernization act law w americanlegion secshulkin long faith confidence values challenge great us conquer alconv republican senate get rid filibuster rule go simple majority dems would wasting time last night phoenix read things statements charlottesville fake news media cover fairly people got phoenix crowd last night amazing packed house love great state arizona fan jeff flake weak crime border make america great draintheswamp phoenixrally media give platform hate groups media turns blind eye gang violence streets thank arizona beautiful turnout phoenix tonight full coverage rally via facebook thank great men women u customs border protection facility yuma arizona around united states;36.93331
2017-08-24;great honor spend time brave heroes usmc air station yuma thank service united staes america hurricaneharvey intensifies remember planahead tuesday visited incredible men women icegov dhsgov border patrol yuma az thank respect cherish problem mitch mcconnell hearing repeal replace years failed never happened james clapper famously got caught lying congress authority donald trump show beautiful letter enthusiastic dynamic fun american legion v respectful strong bad dems one change tones james clapper famously got caught lying congress authority donald trump show beautiful letter enthusiastic dynamic fun american legion v respectful strong bad dems one change tones fake news complaining different types back back speeches well afghanistan somber big rally enthusiastic dynamic fun american legion v respectful strong bad dems one change tones fake news complaining different types back back speeches well afghanistan somber big rally big deal dems holding usual debt ceiling approval could easy mess requested mitch paul r tie debt ceiling legislation popular v bill passed easy approval donald e ballard behalf people united states thank courageous service inspire us alconv;36.92144
2017-08-25;storm turned hurricane getting much bigger powerful projected federal government site ready respond safe arrived camp david monitoring path doings hurricane harvey strengthens class mph winds arrived camp david closely watching path doings hurricane harvey strengthens category safe encourage everyone path hurricaneharvey heed advice orders local state officials received hurricaneharvey briefing morning acting dhsgov secretary elaine duke fema brock tombossert cos john kelly spoken w govabbott texas louisianagov edwards closely monitoring hurricaneharvey developments assist needed strange statement bob corker considering constantly asking whether run tennessee happy nick adams retaking america best things presidency reported convinced perhaps best presidency ever administrations done months trump bills passed regulations killed border military isis sc general john kelly fantastic job chief staff tremendous spirit talent w h believe fake news senate republicans get rid filibuster rule go majority bills passed dems control senate great honor spend time brave heroes usmc air station yuma thank service united states america;36.92813
2017-08-26;wonderful coordination federal state local governments great state texas teamwork record setting rainfall thank great volunteers helping hurricaneharvey relief texas closely monitoring hurricaneharvey camp david leaving nothing chance city state federal govs working great together chuckgrassley got message loud clear fantastic people ground got long harvey far good great job world watching safe remain fully engaged w open lines communication hurricaneharvey makes landfall america w govabbott fema dhsgov pleased inform granted full pardon year old american patriot sheriff joe arpaio kept arizona safe request governor texas signed disaster proclamation unleashes full force government help;36.82207
2017-08-27;historic rainfall houston texas floods unprecedented rain coming spirit people incredible thanks major rescue operations underway going cabinet meeting tele conference harvey even experts said never seen one like nafta worst trade deal ever made renegotiation process mexico canada difficultmay terminate mexico one highest crime nations world must wall mexico pay reimbursement wow experts calling harvey year flood effort going going well also going wonderful state missouri lot dem c opposed big tax cuts republican win going texas soon trip made without causing disruption focus must life safety many people saying worst storm hurricane ever seen good news great talent ground great coordination agencies levels government continuing rains flash floods dealt thousands rescued great book great guy highly recommended;37.31853
2017-08-29;foxandfriends looking fill positions need many reduce size government ingrahamangle leaving texas;37.3336
2017-08-30;texas louisiana w today w tomorrow w every single day restore recover rebuild leaving missouri soon speech tax cuts tax reform badly needed reading false reporting even ferocious anger dying magazines makes wonder want maga witnessing first hand horror devastation caused hurricane harveymy heart goes even great people texas u talking north korea paying extortion money years talking answer;37.28516
2017-08-31;thank incredible heroes texas america texasstrong first responders heroic work courage devotion saved countless lives represent best america;37.35038
