Date;text;approval_date
2017-01-20;americans americans every city near far small large mountain mountain time remember follow two simple rules buy american hire american inaugurationday maga bring back jobs bring back borders bring back wealth bring back dreams forgotten men women country forgotten longer moment fs going americafirst january th remembered day people became rulers nation truly matters party controls government whether government controlled people power washington c giving back american people inaugurationday today merely transferring power one administration another one party another transferring begins today see swearing movement continues work begins thank wonderful evening washington c inauguration thank joining us lincoln memorial tonight special evening together going make c;45.46693
2017-01-21;fantastic day evening washington c thank foxnews many news outlets great reviews speech thank another wonderful evening washington c together make america great;45.44264
2017-01-22;peaceful protests hallmark democracy even always agree recognize rights people express views wow television ratings million people watched inauguration million good ratings years ago watched protests yesterday impression election people vote celebs hurt cause badly great meeting cia headquarters yesterday packed house paid great respect wall long standing ovations amazing people win;47.76497
2017-01-23;busy week planned heavy focus jobs national security top executives coming talk manufacturing america;44.37598
2017-01-24;signing orders move forward construction keystone xl dakota access pipelines oval c great meeting automobile industry leaders whitehouse morning together maga photo delivered yesterday displayed upper lower press hall thank abbas meeting top automobile executives concerning jobs america want new plants built cars sold;44.13586
2017-01-25;interviewed davidmuir tonight clock abc first interview white house c making supreme court pick thursday next week thank even registered vote dead many long time depending results strengthen voting procedures asking major investigation voter fraud including registered vote two states illegal big day planned national security tomorrow among many things build wall chicago fix horrible carnage going shootings killings send feds congratulations foxnews number one inauguration ratings many times higher fake news cnn public smart great meeting ford ceo mark fields general motors ceo mary barra whitehouse today;43.87527
2017-01-26;miami dade mayor drops sanctuary policy right decision strong interviewed seanhannity foxnews pm tonight enjoy spoke congressional gop retreat philadelphia pa afternoon w vp senatemajldr speakerryan th c spoke congressional gop retreat philadelphia pa afternoon w vp senmajleader speakerryan th c jobs companies lost mexico unwilling pay badly needed wall would better cancel upcoming meeting u billion dollar trade deficit mexico one sided deal beginning nafta massive numbers ungrateful traitor chelsea manning never released prison calling president obama weak leader terrible interview david muir abc news minutes enjoy romoabcnews davidmuir first potus interview since taking office tonight abcworldnews abc tonight president higher duty protect lives american people beginning today united states america gets back control borders full speech today dhsgov c;44.14589
2017-01-27;promise administration always back always congratulations secretary mattis statement international holocaust remembrance day vp mike pence speaking today marchforlife full support marchforlife important marching full support mexico taken advantage u long enough massive trade deficits little help weak border must change look forward seeing final results votestand gregg phillips crew say least votes illegal must better;44.09903
2017-01-28;interviewed thebrodyfile cbnnews tonight pm enjoy today remember crew space shuttle challenger years later neverforget dwindling subscribers readers got wrong right beginning still changed course never dishonest thr coverage nytimes washingtonpost gas false angry times actually apologized failing nytimes wrong beginning said would lose primaries general election fake news;44.34048
2017-01-29;interviewed thebrodyfile cbnnews tonight pm enjoy statement regarding recent executive order concerning extreme vetting senators focus energies isis illegal immigration border security instead always looking start world war iii joint statement former presidential candidates john mccain lindsey graham wrong sadly weak immigration two christians middle east executed large numbers cannot allow horror continue country needs strong borders extreme vetting look happening europe indeed world horrible mess somebody aptitude conviction buy fake news failing nytimes either run correctly let fold dignity;44.79341
2017-01-30;american dream back fre going create environment small business like ft many c outrage democrats opposition party media jobs fleeing country made decision nominate united states supreme court announced live tuesday p w h ban announced one week notice bad would rush country week lot bad dudes nothing nice searching terrorists enter country big part campaign study world protesters tears senator schumer secretary kelly said going well problems make america safe people detained held questioning big problems airports caused delta computer outage;44.81124000000001
2017-01-31;democrats give us attorney general rest cabinet ashamed wonder c work nancy pelosi fake tears chuck schumer held rally steps supreme court mic work mess like dem party democrats delaying cabinet picks purely political reasons nothing going obstruct obama g;44.21341
2017-02-01;everybody arguing whether ban call want keeping bad people bad intentions country hope like nomination judge neil gorsuch united states supreme court good brilliant man respected join live whitehouse getting ready deliver important decision p;44.23746
2017-02-02;thank samsung would love iran last legs ready collapse u came along gave life line form iran deal billion iran formally put notice firing ballistic missile thankful terrible deal u made attending chief ryan owens dignified transfer yesterday daughter ivanka great honor great brave man thank congratulations rex tillerson sworn new secretary state star u c berkeley allow free speech practices violence innocent people different point view federal funds believe obama administration agreed take thousands illegal immigrants australia study dumb deal iran rapidly taking iraq even u squandered three trillion dollars obvious long ago;44.43742
2017-02-03;must keep evil country new radical islamic terrorist attacked louvre museum paris tourists locked france edge get smart u professional anarchists thugs paid protesters proving point millions people voted make america great meeting biggest business leaders morning good jobs coming back u health care tax bills crafted thank prime minister australia telling truth civil conversation fake news media lied nice iran playing fire appreciate kind president obama yes arnold schwarzenegger really bad job governor california even worse apprentice least tried hard;44.42256
2017-02-04;lawyers looking using federal court decision boston conflict ridiculous lift ban decision ban lifted judge many bad dangerous people may pouring country terrible decision country coming judge halt homeland security travel ban anyone even bad intentions come u make america great forced apologize bad inaccurate coverage winning election fake news nytimes still lost opinion called judge essentially takes law enforcement away country ridiculous overturned interesting certain middle eastern countries agree ban know certain people allowed death destruction country longer able say cannot come especially reasons safety security big trouble countries charge u companies taxes tariffs u charges nothing little charge charge us;44.65995
2017-02-05;enjoy superbowl continue make america great interviewed oreillyfactor p prior superbowl pre game show fox network enjoy instructed homeland security check people coming country carefully courts making job difficult cannot believe judge would put country peril something happens blame court system people pouring bad judge opens country potential terrorists others best interests heart bad people happy interview oreillyfactor fox network p prior super bowl enjoy;44.50491
2017-02-06;extended interview super bowl oreillyfactor airs tonight p enjoy failing nytimes writes total fiction concerning gotten wrong two years making stories sources interviewed oreillyfactor tonight p call shots largely based accumulation data everyone knows fake news media order marginalize lies negative polls fake news like cnn abc nbc polls election sorry people want border security extreme vetting amazing comeback win patriots tom brady bob kraft coach b total winners wow;44.34582
2017-02-07;honor national sheriffs assoc join whitehouse incredible men women protect serv c know putin deals russia haters going crazy yet obama make deal iran terror problem know putin deals russia haters going crazy yet obama make deal iran terror problem threat radical islamic terrorism real look happening europe middle east courts must act fast failing nytimes forced apologize subscribers poor reporting election win worse;44.28156
2017-02-08;trump administration seen truthful news media majority leading eu nations support trump style travel ban poll people countries immigration ban one trump popular orders far thank brian krzanich ceo intel great investment billion american innovation jobs c big increase traffic country certain areas people far vulnerable wait easy fake news stories reporters run since trump daughter ivanka treated unfairly nordstrom great person always pushing right thing terrible thank great police chiefs sheriffs leadership service true friend c speaking today police chiefs sheriffs discussing horrible dangerous wrong decision u win case obviously never security safety entitled politics disgrace full cabinet still place longest delay history country obstruction democrats;44.42348
2017-02-09;see court security nation stake join us live oval office swearing new attorney general senatorsessions live c ryan died winning mission according general mattis failure time u get smart start winning long know win anymore look mess country bogged conflict place hero sen mccain talking success failure mission media emboldens enemy losing chris cuomo interview sen blumenthal never asked long term lie brave service vietnam fake news sen richard blumenthal never fought vietnam said years major lie misrepresents judge gorsuch told congratulations new attorney general senatorsessions;44.30565
2017-02-10;heading joint base andrews marineone prime minister shinz earlier today failing nytimes major fake news china story saying mr xi spoken mr trump since nov spoke length yesterday lawfare remarkably entire opinion panel bother even cite statute disgraceful decision;43.46242
2017-02-11;working dinner tonight prime minister abe japan representatives winter white house mar lago good talks played golf today prime minister abe japan thebig easy ernie els great time japan well represented playef golf today prime minister abe japan thebig easy ernie els great time japan well represented proud daughter ivanka abused treated badly media still hold head high truly wonderful great time hosting prime minister shinzo abe united states melania hosting japanese prime minister shinzo abe mrs abe mar lago palm beach fla wonderful couple design negotiations yet like f fighterjet air force one program price come way reading great border wall cost government originally thought gotten involved legal system broken refugees allowed u since travel reprieve hail seven suspect countries wt dangerous;44.47177
2017-02-12;leaving florida big crowds enthusiastic supporters lining road fake news media refuses mention dishonest congratulations stephen miller representing morning various sunday morning shows great job know mark cuban well backed big time interested taking calls smart enough run president two days productive talks prime minister abe heading back japan l fake news cnn bernie sanders cut using term fake news describe network said technical difficulties refugees admitted u court breakdown countries syria iraq somalia iran sudan libya yemen crackdown illegal criminals merely keeping campaign promise gang members drug dealers others removed icymi joint statement prime minister shinzo abe north korea;44.49281
2017-02-13;wonderful meeting canadian pm justintrudeau group leading ceo business women canada th c welcome whitehouse prime minister justintrudeau today meet canadian pm trudeau group leading business women discuss women workforce;44.57693
2017-02-14;obamacare continues fail humana pull repeal replace save healthcare americans remarks president trump signing h j resolution great parent teacher listening session morning vp pence usedgov secretary betsydevos watch c real story many illegal leaks coming washington leaks happening deal n korea etc congratulations new vasecretary dr david shulkin time take care veterans fought protect c congratulations treasury secretary steven mnuchin icymi watch;44.46416
2017-02-15;venezuela allow leopoldo lopez political prisoner husband liliantintori met w marcorubio c aetna ceo obamacare death spiral repealandreplace join florida saturday pm rally orlando melbourne international airport tickets c welcome united states israelipm benjamin sara icymi joint press conference great listening session ceo retail industry leaders association morning real scandal classified information illegally given intelligence like candy un american crimea taken russia obama administration obama soft russia thank eli lake bloomberg view nsa fbi interfere politics serious situation usa information illegally given failing nytimes washingtonpost intelligence community nsa fbi like russia russian connection non sense merely attempt cover many mistakes made hillary clinton losing campaign fake news media going crazy conspiracy theories blind hatred msnbc cnn unwatchable foxandfriends great;44.31153
2017-02-16;trump signs bill undoing obama coal mining rule democrats come story lost election badly made story russia fake news fake news media makes stories sources far effective discredited democrats fading fast spotlight finally put low life leakers caught leaking even illegal classified leaking big problem washington years failing nytimes others must apologize stock market hits new high longest winning streak decades great level confidence optimism even tax plan rollout;44.10547
2017-02-17;one effective press conferences ever seen says rush limbaugh many agree yet fake media calls differently dishonest fake news media failing nytimes nbcnews abc cbs cnn enemy enemy american people fake news media failing nytimes cnn nbcnews many enemy enemy american people sick join watch general keith kellogg known long time much play nsa three others thank nice statements press conference yesterday rush limbaugh said one greatest ever fake media happy going charleston south carolina order spend time boeing talk jobs look forward despite long delays democrats finally approving dr tom price repeal replacement obamacare moving fast;43.83627
2017-02-18;getting ready leave melbourne florida see soon many meetings weekend southern white house big p speech melbourne florida lot talk believe main stream fake news media white house running well inherited mess process fixing looking forward florida rally tomorrow big crowd expected;43.66503
2017-02-19;statement happening sweden reference story broadcast foxnews concerning immigrants sweden;42.54541
2017-02-20;named general h r mcmaster national security advisor meeting generals mar lago florida interesting happy presidents day make america great give public break fake news media trying say large scale immigration sweden working beautifully;43.00062
2017-02-21;called angry crowds home districts republicans actually numerous cases planned liberal activists sad americans overwhelmingly oppose sanctuary cities congratulations new national security advisor general h r mcmaster video;43.10133
2017-02-22;much enjoyed tour smithsonian national museum african american history culture great job done amazing people one thing say rep keith ellison fight lead dnc one predicted early would win;42.99247
2017-02-23;p edges higher trump renews jobs pledge;42.94234
2017-02-24;trump vows fight epidemic human trafficking going cpac find leakers within fbi classified information given media could devastating effect u find fbi totally unable stop national security leakers permeated government long time even big interview tonight henry kravis business council washington looking forward seven people shot killed yesterday chicago going totally control chicago needs help;42.97042
2017-02-25;congratulations thomas perez named chairman dnc could happier republican party attending white house correspondents association dinner year please wish everyone well great evening weekly address whitehouse great optimism future u business jobs dow th straight record close big tax regulation cuts coming media reported national debt first month went billion vs billion increase obama first mo maybe millions people voted make america great rally would biggest fake news media knowingly tell truth great danger country failing nytimes become joke likewise cnn sad;42.93886
2017-02-26;big dinner governors tonight white house much discussed including healthcare russia talk fake news put dems played media order mask big election defeat illegal leaks first time failing nytimes take ad bad one help save failing reputation try reporting accurately fairly race dnc chairman course totally rigged bernie guy like bernie never chance clinton demanded perez;43.75505
2017-02-27;gop viewed favorably dems trump era per nbc wsj poll via hotlinejosh great meeting ceos leading u health insurance companies provide great healthcare american peo c;43.71027
2017-02-28;interviewed foxandfriends enjoy;43.90226
2017-03-01;thank jointsession maga join live p jointaddress;43.90226
2017-03-02;since november th election day stock market posted trillion gains consumer confidence year high jobs;43.93693
2017-03-03;make america great hereby demand second investigation schumer pelosi close ties russia lying hearby demand second investigation schumer pelosi close ties russia lying must fix education system kids make america great wonderful day saint andrew orlando hear demand second investigation schumer pelosi close ties russia lying start immediate investigation senschumer ties russia putin total hypocrite weekly addressjoin pathetic dems still approved full cabinet nick adams new book green card warrior must read merit based system way go canada australia foxandfriends illegal leaks classified information total witch hunt win democrats overplaying hand lost election lost grip reality real story intentional whole narrative way saving face democrats losing election everyone thought supposed jeff sessions honest man say anything wrong could stated response accurately clearly;44.08371
2017-03-04;arnold schwarzenegger voluntarily leaving apprentice fired bad pathetic ratings sad end great show low president obama gone tapp phones sacred election process nixon watergate bad sick guy bet good lawyer could make great case fact president obama tapping phones october prior election legal sitting president wire tapping race president prior election turned court earlier new low russian ambassador met jeff sessions visited obama white house times times last year alone terrible found obama wires tapped trump tower victory nothing found mccarthyism first meeting jeff sessions russian amb set obama administration education program ambs;44.3455
2017-03-05;thank great rallies across country tremendous support make america great secretly said russian president tell vladimir election flexibility foxandfriends true dnc would allow fbi access check server equipment learning hacked possible;44.33974
2017-03-06;incredible spirit optimism sweeping country right bringing back jobs construction manufacturing jobs u gulf coast region billion investment already winning america buy american hire american principals core agenda jobs jobs jobs thank exxonmobil president trump congratulates exxon mobil job creating investment program;44.25294
2017-03-07;let fake news tell big infighting trump admin getting along great getting major things done working new system competition drug industry pricing american people come way worry getting rid state lines promote competition phase healthcare rollout foxandfriends eight years russia ran president obama got stronger stronger picked crimea added missiles weak foxandfriends wonderful new healthcare bill review negotiation obamacare complete total disaster imploding fast vicious prisoners released obama administration gitmo returned battlefield another terrible decision thank exxonmobil billion investment creating manufacturing construction jobs usa buy american hire american principles core agenda jobs jobs jobs thank exxonmobil;44.51029000000001
2017-03-08;great news beginning together going maga met repcummings today whitehouse great discussion linkedin workforce report january february strongest consecutive months hiring since august september international women day join honoring critical role women america around world tremendous respect women many roles serve vital fabric society economy feel sure friend randpaul come along new great health care program knows obamacare disaster;44.6835
2017-03-09;honored meet years senateyouth delegates w vp pence east room whitehouse congratulations c u consumer comfort reached highest level decade despite hear press healthcare coming along great talking many groups end beautiful picture;44.76669
2017-03-10;weekly address whitehouse maga;44.53927
2017-03-11;making great progress healthcare obamacare imploding get worse republicans coming together get job done;44.29615
2017-03-13;meeting w washington c mayorbowser metro gm paul wiedefeld incoming winter storm preparations c proud welcome great cabinet afternoon first meeting unfortunately seats empty c healthcare listening session w vp secpricemd watch readthebill c obamacare imploding disaster worst year yet far republicans come together save day amazing rude much media hard working representatives nice much better;43.59192
2017-03-14;great optimism america results even better jobs jobs jobs;43.36182
2017-03-15;thank andrew jackson potus usa interviewed tuckercarlson tonight p foxnews enjoy ceo optimistic since get better continue slash unnecessary regulations begin big tax cut looking forward big rally nashville tennessee tonight big crowd great people expected fun going detroit michigan love today big meeting bringing back car production state u already happening imagine outcry would snoopdogg failing career aimed fired gun president obama jail time anybody really believe reporter nobody ever heard went mailbox found tax returns nbcnews fake news;42.70947
2017-03-16;representatives great meeting w hispanic chamber commerce wh today look forward tremendous growth future mtgs great progress healthcare improvements made republicans coming together honor welcome taoiseach ireland endakennytd whitehouse today vp pence budget puts americafirst must make safety priority without safety prosperity thank nashville tennessee nashville tennessee lets make america great;42.48279
2017-03-17;great meeting republicanstudy committee morning whitehouse president changed small businesses confidence north korea behaving badly playing united states years china done little help happy la fheile phadraig great irish friends;42.56183
2017-03-18;vast sums money nato united states must paid powerful expensive defense provides germany despite heard fake news great meeting german chancellor angela merkel nevertheless germany owes;42.41769
2017-03-19;icymi weekly address;42.34076
2017-03-20;thank louisville kentucky way maga congratulations eric lara proud happy two contact clinton campaign russians also true dnc would let fbi look heard fake news cnn polls despite fact election polls way disaster much higher ratings fox real story congress fbi others looking leaking classified information must find leaker democrats made pushed russian story excuse running terrible campaign big advantage electoral college lost james clapper others stated evidence potus colluded russia story fake news everyone knows;42.28773
2017-03-21;today nationalagday honor great american farmers ranchers hard work dedication ingrained c honored sign today legislation support nasa scientists engineers astronauts c joined housegop conference morning u capitol passthebill maga c thank louisville kentucky together make america safe great;42.15625
2017-03-22;big day healthcare working hard;42.14841
2017-03-23;honor welcome many truckers trucking industry leaders whitehouse today taking action repealandreplace obamacare contact rep tell support ahca passthebill c great american kurt cochran killed london terror attack prayers condolences family friends watched totally biased fake news reports called russia story nbc abc dishonesty spoke u k prime minister theresa may today offer condolences terrorist attack london strong well;42.08798
2017-03-24;today thrilled announce commitment billion k american jobs next years thank c today pleased announce official approval presidential permit keystonepipeline grea c irony freedom caucus pro life planned parenthood allows p p continue stop plan seven horrible years obamacare skyrocketing premiums deductibles bad healthcare finally chance great plan;41.81089
