Date;text;approval_date
2018-01-23;thank general john kelly fantastic job staff others white house job well done long hours fake reporting makes job difficult always great win us nobody knows sure republicans democrats able reach deal daca february everyone trying big additional focus put military strength border security dems learned shutdown answer one biggest stories long time fbi says missing five months worth lovers strzok page texts perhaps prime time wow one biggest stories long time fbi says missing five months worth lovers strzok page texts perhaps prime time wow even crazy jim acosta fake news cnn agrees gtrump world wh sources dancing end zone trump wins schumer dems caved gambled lost h thank honesty jim big win republicans democrats cave shutdown want big win everyone including republicans democrats daca especially great military border security able get see negotiating table;38.82256
2018-01-24;great honor welcome mayor fs across america wh administration always support local government listen leaders know communities best together usher bold new era peace prosperity earlier today spoke govmattbevin kentucky regarding yesterday fs shooting marshall county high school thoughts prayers bailey holt preston cope families wounded victims recovery tremendous investment companies world made america never anything like disney j p morgan chase many others massive regulation reduction tax cuts making us powerhouse long way go jobs jobs jobs cryin f chuck schumer fully understands especially humiliating defeat wall daca must safety security together strong military great people important text messages fbi lovers lisa page peter strzok blaming samsung;38.82256
2018-01-25;today americans everywhere remember brave men women nasa lost lives nation fs eternal quest expand boundaries human potential productive bilateral meeting prime minister benjamin netanyahu israel davos switzerland wef great bilateral meeting prime minister theresa may united kingdom affirming special relationship commitment work together key national security challenges economic opportunities wef soon heading davos switzerland tell world great america economy booming get better country finally winning;38.82256
2018-01-26;thank wonderful welcome wef davos daca made increasingly difficult fact cryin f chuck schumer took beating shutdown unable act immigration heading back exciting two days davos switzerland speech america fs economic revival well received many people met investing u maga join live world economic forum davos switzerland wef great bilateral meeting president alain berset swiss confederation continue strengthen great friendship honor switzerland wef honor meet republic rwanda president paul kagame morning davos switzerland many great discussions wef interviewed squawkcnbc joesquawk coming ame davos switzerland enjoy wef;38.78343
2018-01-27;taliban targeted innocent afghans brave police kabul today thoughts prayers go victims first responders allow taliban win holocaust remembrance day mourn grieve murder million innocent jewish men women children millions others perished evil nazi genocide pledge might resolve never thank brandon judd national border patrol council strong statement foxandfriends badly need wall must also end loophole gcatch release h clean legal procedures border safety security reasons;38.99561
2018-01-28;economy better many decades businesses coming back america like never chrysler example leaving mexico coming back usa unemployment nearing record lows right track somebody please inform jay z policies black unemployment reported lowest rate ever recorded democrats interested border safety security funding rebuilding military interested obstruction offered daca wonderful deal including doubling number recipients twelve year pathway citizenship two reasons republicans want fix long time terrible problem show democrats want solve daca use;39.52642
2018-01-29;congratulations america fs new secretary hhsgov alex azar;39.77913
2018-01-31;join live sotu;40.20801
2018-02-01;thank nice compliments reviews state union speech million people watched highest number history foxnews beat every network first time ever million people tuning delivered heart march th rapidly approaching democrats nothing daca resist blame complain obstruct nothing start pushing nancy pelosi dems work daca fix heading beautiful west virginia great members republican party planning infrastructure discussing immigration daca easy support democrats one dem voted tax cut bill need republicans e;40.20801
2018-02-02;today honor join great men women dhsgov customsborder icegov uscis u customs border protection national targeting center sterling virginia fact sheet gtrump orator outlines greatness america democrats f disgust h million americans receiving bonuses benefits employers result tax cuts great start unemployment rate average earnings last year new american jobs maga gyou hillary clinton democratic party try hide fact gave money gps fusion create dossier used allies obama administration convince court misleadingly accounts spy trump team h tom fitton jw top leadership investigators fbi justice department politicized sacred investigative process favor democrats republicans something would unthinkable short time ago rank file great people democrats ft calling daca nancy pelosi chuck schumer get moving fast fll disappoint great chance make deal blame dems march th coming fast;40.37448
2018-02-03;memo totally vindicates gtrump h probe russian witch hunt goes collusion obstruction word used one year looking endlessly finding nothing collusion dead american disgrace rasmussen announced approval rating jumped far better number winning election higher certain gsacred cows h trump polls way also media refuse write oh well someday;40.13234
2018-02-04;thoughts prayers victims involved mornings train collision south carolina thank incredible first responders work fve done tool anti trump political actors unacceptable democracy ought alarm anyone wants fbi nonpartisan enforcer law fbi ft straight congress hid facts investigators h wall street journal gthe four page memo released friday reports disturbing fact fbi fisa appear used influence election aftermath fbi failed inform fisa court clinton campaign funded dossier fbi became great jobs numbers finally many years rising wages nobody even talks russia russia russia despite fact year looking collusion;40.71095
2018-02-05;thanks historic tax cuts signed law paychecks going way taxes going way america open business representative devin nunes man tremendous courage grit may someday recognized great american hero exposed endure deal daca include strong border security desperately needed wall total waste time march th rapidly approaching dems seem care daca make deal little adam schiff desperate run higher office one biggest liars leakers washington right comey warner brennan clapper adam leaves closed committee hearings illegally leak confidential information must stopped thank foxandfriends exposing truth perhaps fs ratings soooo much better untruthful competition democrats pushing universal healthcare thousands people marching uk u system going broke working dems want greatly raise taxes really bad non personal medical care thanks congratulations philadelphia eagles great super bowl victory;40.81161
2018-02-06;today heard experiences law enforcement professionals community leaders working combat threat ms reforms need congress defeat watch need st century merit based immigration system chain migration visa lottery outdated programs hurt economic national security polling shows nearly americans support immigration reform package includes daca fully secures border ends chain migration cancels visa lottery fs oppose deal ft serious daca want open borders prayers best wishes family edwin jackson wonderful young man whose life senselessly taken colts disgraceful person illegally country killed colts linebacker edwin jackson one many preventable tragedies must get dems get tough border illegal immigration fast;40.83043
2018-02-07;budget agreement today important great military ends dangerous sequester gives secretary mattis needs keep america great republicans democrats must support troops support bill congratulations republic korea magnificent winter olympics south korean people built truly inspiration best wishes republic korea hosting olympics wonderful opportunity show everyone truly great nation new fbi texts bombshells gold days h good news reported stock market would go today good news reported stock market goes big mistake much good great news economy congratulations elonmusk spacex successful falconheavy launch achievement along nasa fs commercial international partners continues show american ingenuity best happy birthday th president united states america ronald reagan;40.83043
2018-02-08;time end visa lottery congress must secure immigration system protect americans long open eyes god fs grace open hearts god fs love america forever land free home brave light unto nations nationalprayerbreakfast meeting henry kissinger pm discussing north korea china middle east founders invoked creator four times declaration independence currency declares gin god trust h place hands hearts recite pledge allegiance proclaim gone nation god h nationalprayerbreakfast heading shortly make remarks national prayer breakfast washington great religious political leaders many friends including v producer mark burnett wonderful season apprentice triumph looking forward seeing;40.83043
2018-02-09;costs non military lines never come elect republicans election beyond bill big victory military much waste order get dem votes fortunately daca included bill negotiations start without republicans congress forced increase spending things like want order finally many years depletion take care military sadly needed dem votes passage must elect republicans election signed bill military stronger ever love need military gave everything first time happened long time also means jobs jobs jobs wow senator mark warner got caught extensive contact lobbyist russian oligarch warner want gpaper trail h gprivate h meeting london requested steele fraudulent dossier fame tied crooked hillary;40.91967
2018-02-10;administration identified three major priorities creating safe modern lawful immigration system fully securing border ending chain migration canceling visa lottery congress must secure immigration system protect americans thoughts prayers two police officers families everybody westervillepd republicans want fix daca far democrats dems three branches government back decided anything daca want use campaign issue vote republican agencies fbi doj state department dig dirt days leading election comey conversations donald trump ft believe accurate leaked information corrupt h tom fitton judicial watch foxnews gmy view trump vindicated last several weeks mishandling dossier lies clinton dnc dossier shows fs victimized fs victimized obama administration using sorts peoples lives shattered destroyed mere allegation true false old new recovery someone falsely accused life career gone thing longer due process according nytimes russian sold phony secrets gtrump h u asking price million brought million paid time hope people seeing understanding going starting come drain swamp democrats sent political long response memo knew sources methods would heavily redacted whereupon would blame white house lack transparency told send back proper form jobless claims dropped year low;40.98163
2018-02-11;spoke johnkasich express condolences prayers horrible shooting two great police officers westervillepd true tragedy rep lou barletta great republican pennsylvania one earliest supporters make fantastic senator strong smart loves pennsylvania loves country voted tax cuts unlike bob casey listened tax hikers pelosi schumer million hard working americans already received large bonus pay increase recently passed tax cut jobs bill get better far ahead schedule many positive things going u fake news media ft want go negative stories wonder people longer trust media whose approval ratings correctly lowest levels history maga;41.42786
2018-02-12;journey maga began cpac opportunity reconnect friends supporters something look forward every year see cpac thank sue kruczek lost wonderful talented son nick opioid scourge kind words foxandfriends fighting terrible epidemic hard nick died vain big week infrastructure stupidly spending trillion middle east time start investing country;41.45908
2018-02-13;negotiations daca begun republicans want make deal democrats say want make deal ft great could finally many years solve daca puzzle last chance never another opportunity march th infrastructure plan put forward received great reviews everyone except course democrats many years taken care military fix roads bridges tunnels airports bipartisan make deal dems;41.3879
2018-02-14;spoke governor rick scott working closely law enforcement terrible florida school shooting prayers condolences families victims terrible florida shooting child teacher anyone else ever feel unsafe american school today honored joined republicans democrats house senate well members cabinet discuss urgent need rebuild restore america fs depleted infrastructure come together celebrate extraordinary contributions african americans nation thoughts turn heroes civil rights movement whose courage sacrifice inspired us proclamation;41.3879
2018-02-15;presidential proclamation honoring victims tragedy parkland florida lottery continues deadly catch release bars enforcement even future illegal immigrants voting amendment would vote law enforcement vote open borders dems actually serious daca support grassley bill schumer rounds collins immigration bill would total catastrophe dhsgov says would gthe end immigration enforcement america h creates giant amnesty including dangerous criminals ft build wall expands chain migration keeps visa times tragedy bonds sustain us family faith community country bonds stronger forces hatred evil bonds grow even stronger hours greatest need republicans democrats congress working hard come solution daca strongly considering system merit based immigration people ready willing able help companies moving usa many signs florida shooter mentally disturbed even expelled school bad erratic behavior neighbors classmates knew big problem must always report instances authorities;41.3879
2018-02-16;russia started anti us campaign long announced would run president results election impacted trump campaign nothing wrong collusion cannot believe badly daca recipients treated democrats totally abandoned republicans still working hard leaving florida today meet bravest people earth people whose lives totally shattered also working congress many fronts;41.14141
2018-02-17;like ft want solve daca problem ft democrats pass gun control legislation house senate obama administration ft want talk gi seen russian ads say definitively swaying election main goal hrob goldmanvice president facebook ads fake news media never fails hard ignore fact vice president facebook ads rob goldman funny fake news media ft want say russian group formed long run president maybe knew going run even though ft know deputy g rod rosenstein stated news conference gthere allegation indictment american knowing participant illegal activity allegation indictment charged conduct altered outcome election gcharges deal big win h written michael goodwin nypost succinctly states gthe russians impact election results h collusion trump campaign gshe lost old fashioned way terrible candidate case closed h melania met incredible people last night broward county florida never forget evening entire nation w one heavy heart continues pray victims families parkland fl teachers law enforcement first responders medical professionals responded bravely face danger thank courage;40.9889
2018-02-18;great friends nascar big race today daytona brian france france family special people enjoy race thank kenstarr former independent counsel whitewater insight powerful words fisa abuse russian meddling etc really great interview mariabartiromo great pollster john mclaughlin gop generic congressional ballot big gain last weeks guess people loving big tax cuts given republicans cuts dems want take away need republicans fake news big ratings loser cnn goal russia create discord disruption chaos within u committee hearings investigations party hatred succeeded beyond wildest dreams laughing asses moscow get smart america adam schiff starting blame president obama russian meddling election probably yet another excuse democrats lead fearless leader crooked hillary clinton lost election ft great candidate never said russia meddle election said git may russia china another country group may pound genius sitting bed playing computer h russian ghoax h trump campaign colluded russia never finally liddle f adam schiff leakin f monster control blaming obama administration russian meddling election finally right something obama president knew threat nothing thank adam never gotten fact obama able send billion dollars cash iran nobody congress fbi justice called investigation general mcmaster forgot say results election impacted changed russians collusion russia crooked h dnc dems remember dirty dossier uranium speeches emails podesta company sad fbi missed many signals sent florida school shooter acceptable spending much time trying prove russian collusion trump campaign collusion get back basics make us proud;40.54642
2018-02-19;obama president beyond election ft something russian meddling great reflective president fs day watched insecure oprah winfrey one point knew well interview panel people minutes questions biased slanted facts incorrect hope oprah runs exposed defeated like others;40.57474000000001
2018-02-20;main street booming thanks incredible tax cut reform law shows small business owners optimistic ready grow businesses cameras running another false accusation ft washingtonpost report story women taking money make stories one home mortgage paid foxnews reported ft fit mainstream media narrative woman ft know best knowledge never met front page fake news washington post saying kissed two minutes yet lobby trump tower years ago never happened would public space live security much tougher russia obama look facts total fake news hope republicans great state pennsylvania challenge new gpushed h congressional map way supreme court necessary original correct ft let dems take elections away raise taxes waste money matt schlapp cpac getting ready another exciting event big difference days president obama held white house fve come long way matt republicans leading generic poll perhaps popular tax cuts dems want take away actually want raise taxes substantially also want nothing daca r fs want fix president obama quote election fs thought crooked hillary going win ft want grock boat h easily electoral college whole game changed russian excuse became narrative dems gthere serious person would suggest somehow could even rig america fs elections fs evidence happened past happen time fd invite mr trump stop whining make case get votes h thank foxandfriends great timeline failures obama administration russia including crimea syria much starting win gthe faith donald trump h book david brody scott lamb interesting read enjoy u economy looking good opinion even better anticipated companies pouring back country reversing long term trend leaving unemployment numbers looking great regulations taxes massively cut jobs jobs jobs mittromney announced running senate wonderful state utah make great senator worthy successor orrinhatch full support endorsement;40.01941
2018-02-21;flotus melania join millions people around world mourning passing billy graham prayers children grandchildren great grandchildren worked closely reverend graham lifelong ministry yesterday great honor recognize extraordinary law enforcement officers first responders award highest possible decoration bravery public safety officers medal valor americanheroes question russian meddling took place obama administration right january th ft subject investigation ft obama something meddling ft dem crimes investigation ask jeff sessions great billy graham dead nobody like missed christians religions special man question russian meddling took place obama administration right january th ft subject investigation ft obama something meddling ft dem crimes investigation ask jeff session cnn msnbc whether republican democrat must focus strengthening background checks true thank bad ratings cnn msnbc got scammed covered anti trump russia rally wall wall probably knew fake news rally pushed hard anyway two really dishonest newscasters public wise;40.01941
2018-02-22;today great honor host school safety roundtable whitehouse state local leaders law enforcement officers education officials nothing important protecting children deserve safe deliver behalf entire nation congratulations u women hockey team winning gold goteamusa olympics meeting lawmakers today discuss school safety next week nation fs governors fs many years talk action fll get done many people ft understand ft want understand wayne chris folks work hard nra great people great american patriots love country right thing make america great strongly pushing comprehensive background checks emphasis mental health raise age end sale bump stocks congress mood finally something issue hope potential gsicko shooter h knows school large number weapons talented teachers others instantly shooting sicko never attack school cowards ft go problem solved must offensive defense alone ft work history shows school shooting lasts average minutes takes police first responders approximately minutes get site crime highly trained gun adept teachers coaches would solve problem instantly police arrive great deterrent immediately fire back savage sicko came school bad intentions highly trained teachers would also serve deterrent cowards far assets much less cost guards ggun free h school magnet bad people attacks would end never said ggive teachers guns h like stated fake news cnn nbc said look possibility giving gconcealed guns gun adept teachers military special training experience best teachers lot would able always remember time spent today courageous students teachers families much love midst much pain must let must keep children safe full listening session;39.07833
2018-02-23;thank great men women united states secretservice job well done today flotus melania honored welcome prime minister turnbullmalcolm mrs turnbull australia whitehouse press conference nation fs motto god trust week nation lost incredible leader devoted life helping us understand words really mean never forget historic crowds voice energy profound faith billy graham cpac salute great american flag put hands hearts pledge allegiance proudly stand national anthem cpac years rebuilding nations finally rebuilding nation restoring confidence pride cpac still interested democrats totally forgotten daca lot interest subject daughter ivanka arrived south korea cannot better smarter person representing country cpac today ms gang members removed great ice border patrol agents thousands killers come back el salvador mexico like water el salvador takes money mexico must help problem need wall gschool shooting survivor says quit cnn town hall refusing scripted question h tuckercarlson like much cnn fake news fs ratings bad msnbc may worse;39.37048
2018-02-24;grussians compromising information donald trump h foxnews course none never whole witch hunt illegal disgrace obama nothing russia dem memo fbi disclose clients clinton campaign dnc wow democrat memo response government surveillance abuses total political legal bust confirms terrible things done illegal big cpac straw poll results approve job president trump thank say president trump tweet funny say republicans congress better job working president trump starting happen dems longer talking daca gout sight mind h say daca beneficiaries happy nancy pelosi truly ft care republicans stand ready make deal unemployment claims lowest level since much massive cutting unnecessary job killing regulations democrat judges totally redrawn election lines great state pennsylvania foxnews unfair republicans country whole must appealed united states supreme court asap armed educators trusted people work within school love students protect smart people must firearms adept annual training get yearly bonus shootings happen big inexpensive deterrent states true wayne lowest black unemployment history;39.63747
2018-02-25;interviewed judgejeanine foxnews p enjoy gcongressman schiff omitted distorted key facts h foxnews else new total phony;40.03228
